{
  "schema_version": "0.1",
  "run_id": "GU-001-GR-001",
  "evaluation_status": "provisional",
  "receiving_owner": "possibility-to-capability",
  "source_packet_ref": {
    "packet_id": "GU-001",
    "packet_digest": "a3f7fc5d99f3810ad86b783365e130749d137e227e6ac97021c26a54a9fff1be",
    "source_revision": "d62a82f3a74731b322a5d65b5ee15a2b861e2855"
  },
  "receiver_assessment_ref": {
    "assessment_id": "GU-001-IA-001",
    "assessment_sha256": "77646c7d381f391a4f882848ca6689987fb68a13636f8a935843dc006dbafe02"
  },
  "source_preservation": {
    "source_packet_frozen": true,
    "source_content_modified": false,
    "source_status_unchanged": true,
    "authority_transfer": false
  },
  "outcome_model": {
    "gate_outcomes": [
      "PASS",
      "FAIL",
      "BLOCKED",
      "INDETERMINATE"
    ],
    "malformed_outcome": "INVALID",
    "success_rule": "ALL_EIGHT_PASS_ONE_CHAIN_LABEL_INVARIANT"
  },
  "one_chain_control": {
    "required_argument_chain_id": "GU-001-W211-LOCATED-NOT-FORCED",
    "required_construction_branch_id": "program-native",
    "single_argument_ref": "gu-formalization:explorations/W211-krein-sign-godel-independent-five-method-synthesis-2026-07-14.md@d62a82f3 (sha256 0e1c213d2ab60d644113efc4b9b4fe884186761489ba320dc37834520b9928b6), read under receiver annotations A/B/C"
  },
  "neutrality_control": {
    "label_permutation": {
      "left_before": "C_good / record-count mode Krein-NEGATIVE (eta_+ positive-definite)",
      "right_before": "C_path / record-count mode Krein-POSITIVE (indefinite total metric)",
      "left_after": "C_path / record-count mode Krein-POSITIVE (indefinite total metric)",
      "right_after": "C_good / record-count mode Krein-NEGATIVE (eta_+ positive-definite)"
    },
    "verdict_before": "NO_BRANCH_SELECTED",
    "verdict_after": "NO_BRANCH_SELECTED",
    "label_invariant": true,
    "artifact_ref": "gu-formalization:tests/W210_decisive_bit_helmholtz.py (sign-blindness lemma, re-run exit 0) + explorations/time-as-finality-crosswalk/adapter2-correction-polarity-fiber-not-axis-2026-07-15.md (two flipped anchors) at pin 77879e5"
  },
  "gate_results": [
    {
      "gate_id": "provenance",
      "ordinal": 1,
      "prerequisite_gate_ids": [],
      "status": "PASS",
      "status_reason": "Every statement in the packet traces to frozen source truth at evidence pin d62a82f3 (ancestor of import pin 77879e5): 16/16 manifest blob hashes verified, three digests recomputed and matching, v0.2 contract 0 errors. Two logged variances do not defeat provenance: (i) source.issued_at (12:00:00-05:00) predates the evidence pin's commit time (14:14:51) and the issuance commit (14:29) - internally anachronistic, git commit times govern; (ii) RESEARCH-STATUS.md line 124 says 'FIVE independent methods' while the packet's stricter typing (raw_method_count_is_independence_count=false) governs; (iii) the hash_scope freezes bytes but not the runtime closure: tests/W210_decisive_bit_helmholtz.py imports tests/generation-sector/gen_sector_bridge.py, which is OUTSIDE the 16-file hash_scope (verified byte-identical at pin and HEAD, sha256 dc9b8297f392d49147944edfbf9636cda86b2ede7c9f2bf5283bc9396e0a4ec7), so W210's re-execution receipt comes from the pinned repo tree, not the extracted bundle alone.",
      "argument_chain_id": "GU-001-W211-LOCATED-NOT-FORCED",
      "construction_branch_id": "program-native",
      "argument_ref": "gu-formalization:explorations/W211-krein-sign-godel-independent-five-method-synthesis-2026-07-14.md@d62a82f3 (sha256 0e1c213d2ab60d644113efc4b9b4fe884186761489ba320dc37834520b9928b6), read under receiver annotations A/B/C",
      "source_evidence_refs": [
        "/integrity",
        "/source",
        "/evidence_structure/raw_method_count_is_independence_count"
      ],
      "receiver_assessment_refs": [
        "/source_packet_ref",
        "/guards",
        "/source_wording"
      ],
      "receiver_judgment": {
        "owner": "possibility-to-capability",
        "statement": "The frozen packet, its 16-artifact bundle, and the receiver assessment all pin the same packet identity and bytes; the two wording/timestamp variances are logged in the import record as receiver-side annotations, not packet edits.",
        "grade": "exploration-tier receiver-verified structural judgment; confers no promotion of the source claim (exploration) or its grades",
        "verification": "16/16 manifest blobs re-extracted from git pin 77879e5 and re-hashed (all match byte_length + content_sha256); manifest/packet/bundle digests recomputed under ptc-frozen-bundle-v1 (match); v0.2 contract validate_packet 0 errors; packet-pair blob sha256s recorded in the import record."
      },
      "falsifiers": [
        "Any manifest blob at the pin fails its byte_length or content_sha256.",
        "Any of manifest_digest, packet_digest, or bundle_digest fails recomputation under ptc-frozen-bundle-v1 (the live CRLF working-tree rendering of the packet JSON, sha256 385f97b1..., demonstrates the byte-level check has a real failing direction; the frozen blob 0f972016... is what passes).",
        "A packet statement cites a source artifact absent from the pinned revision."
      ],
      "nonclaims": [
        "This provenance pass does not establish any physical claim or the truth of any method's conclusion.",
        "Logging the issued_at anachronism does not amend the packet; the field stands as issued.",
        "The manifest freezes bytes, not execution environments; the W210 runtime-closure gap is a logged bundle limitation (receiver Annotation E), not a packet defect or edit."
      ]
    },
    {
      "gate_id": "construction",
      "ordinal": 2,
      "prerequisite_gate_ids": [
        "provenance"
      ],
      "status": "PASS",
      "status_reason": "Both material construction forks are explicit in the frozen packet with transfer status: (1) program-native Krein/C-operator objects vs standard-field machinery (selected: program-native; transfers); (2) grading sign derived-in-form vs posited-in-sign (selected: posited-in-sign, RESIDUAL-BIT-STANDS; does_not_transfer). The Cl(9,5)=M(64,H) rep-canonicity caveat is carried as an explicit conditional construction premise.",
      "argument_chain_id": "GU-001-W211-LOCATED-NOT-FORCED",
      "construction_branch_id": "program-native",
      "argument_ref": "gu-formalization:explorations/W211-krein-sign-godel-independent-five-method-synthesis-2026-07-14.md@d62a82f3 (sha256 0e1c213d2ab60d644113efc4b9b4fe884186761489ba320dc37834520b9928b6), read under receiver annotations A/B/C",
      "source_evidence_refs": [
        "/construction_forks/0",
        "/construction_forks/1",
        "/evidence_structure/premise_ledger/0"
      ],
      "receiver_assessment_refs": [
        "/classification/limiting_premise_ids"
      ],
      "receiver_judgment": {
        "owner": "possibility-to-capability",
        "statement": "The construction choices this run depends on are visible, typed, and retained; the does_not_transfer status of fork 2 is exactly the located-not-forced content, so no admissible branch has been silently removed (Construction-Fork Rule respected: both sign branches remain live).",
        "grade": "exploration-tier receiver-verified structural judgment; confers no promotion of the source claim (exploration) or its grades",
        "verification": "Both construction_forks read from the frozen packet with transfer_status; the rep-canonicity caveat is carried as premise P-CL95-REPCANON (conditional_in_source) and as limiting premise in GU-001-IA-001."
      },
      "falsifiers": [
        "A materially admissible construction branch is absent from the frozen packet.",
        "The run's conclusions require the standard-field branch where the packet only established the program-native one (fork 2's transfer_status = does_not_transfer marks precisely where transfer would fail)."
      ],
      "nonclaims": [
        "The pass does not show the result transfers to a standard-field-only construction; fork 2 is explicitly non-transferring.",
        "The rep-canonicity caveat is not discharged; it is carried."
      ]
    },
    {
      "gate_id": "formation",
      "ordinal": 3,
      "prerequisite_gate_ids": [
        "provenance",
        "construction"
      ],
      "status": "PASS",
      "status_reason": "One coherent joint object forms without changing source meanings: GU's good-stable structure plus exactly one external Z/2 datum at a typed GU/TI/TaF boundary. All five methods address the same frame, the same fork, and the same external datum (all five share all five load-bearing premises); the joint argument is the single frozen artifact W211. Formation succeeds only under receiver Annotation A: the '=' chains in P-EXTERNAL-C-OPERATOR and the 'TaF-owned finality activation' apposition inside claim.statement are read as typed-interface descriptions per the packet's own nonclaims, with the 2026-07-15 adapter-2 correction governing.",
      "argument_chain_id": "GU-001-W211-LOCATED-NOT-FORCED",
      "construction_branch_id": "program-native",
      "argument_ref": "gu-formalization:explorations/W211-krein-sign-godel-independent-five-method-synthesis-2026-07-14.md@d62a82f3 (sha256 0e1c213d2ab60d644113efc4b9b4fe884186761489ba320dc37834520b9928b6), read under receiver annotations A/B/C",
      "source_evidence_refs": [
        "/claim/joint_argument_artifact",
        "/method_ledger",
        "/evidence_structure/shared_load_bearing_premise_ids",
        "/nonclaims/1"
      ],
      "receiver_assessment_refs": [
        "/classification/basis_method_ids",
        "/classification/rationale"
      ],
      "receiver_judgment": {
        "owner": "possibility-to-capability",